,all_awardings,archived,associated_award,author,author_flair_background_color,author_flair_css_class,author_flair_richtext,author_flair_template_id,author_flair_text,author_flair_text_color,author_flair_type,author_fullname,author_patreon_flair,author_premium,body,body_sha1,can_gild,collapsed,collapsed_because_crowd_control,collapsed_reason,collapsed_reason_code,comment_type,controversiality,created_utc,distinguished,gilded,gildings,id,is_submitter,link_id,locked,no_follow,parent_id,permalink,retrieved_utc,score,score_hidden,send_replies,stickied,subreddit,subreddit_id,subreddit_name_prefixed,subreddit_type,top_awarded_type,total_awards_received,treatment_tags,unrepliable_reason
0.0,[],False,,elvecent,,,[],,,,text,t2_bwz58lm,False,False,"It's definitely a code smell if it's in your business logic. However, if it only emerges when you interpret that logic into something you really intend to use IO calls, then it's fine.

In your business logic, ideally you should have custom effects/typeclasses forming a vocabulary that makes sense to a domain expert who is not necessarily a programmer.",51e047d22777550b2beda91518c11cfd0e23890b,True,False,,,,,0,1647204353,,0,{},i0j9w8v,False,t3_td22b3,False,True,t3_td22b3,/r/haskell/comments/td22b3/question_from_a_beginner_is_liftio_a_code_smell/i0j9w8v/,1647204370,1,False,True,False,haskell,t5_2qh36,r/haskell,public,,0,[],
1.0,[],False,,tomejaguar,,,[],,,,text,t2_45sug,False,False,"&gt; And taking the maxTupleSize down to 30, 10, 5, even 0 and -1 doesn't help, still out of memory

What happens if you just delete the contents of that module entirely?

&gt; I'm going to ask ghcup to compile GHC from source, perhaps it'll help

Hmm ... I can't quite imagine that working, but if it does then great!",0b4da1f6b4b7a70770afb3e8bce4866b23edb106,True,False,,,,,0,1647200417,,0,{},i0j0v30,False,t3_tbn46e,False,True,t1_i0ixbn2,/r/haskell/comments/tbn46e/out_of_memory_when_building_productprofunctors/i0j0v30/,1647200436,1,False,True,False,haskell,t5_2qh36,r/haskell,public,,0,[],
2.0,[],False,,Swordlash,,,[],,,,text,t2_2fpxe4mw,False,False,"Actually the module it fails compiling on is `Data.Profunctor.Product.Tuples`, which apart from imports is basically a single directive: `mkTs [0..maxTupleSize]`

So I guess that TH is a culprit here.",6213b7568def5e9245b7bd59ad3af1239a4ad715,True,False,,,,,0,1647198892,,0,{},i0ixbn2,True,t3_tbn46e,False,True,t1_i0ih4gx,/r/haskell/comments/tbn46e/out_of_memory_when_building_productprofunctors/i0ixbn2/,1647198904,1,False,True,False,haskell,t5_2qh36,r/haskell,public,,0,[],
3.0,[],False,,gdeest,,,[],,,,text,t2_f9a1w,False,False,I stand corrected: https://github.com/haskell-servant/servant/issues/986#issuecomment-1065996140,8801a79fd5719680953aa26509ec606abf6df2aa,True,False,,,,,0,1647196428,,0,{},i0irjh6,False,t3_t8rwe2,False,True,t1_i081i9n,/r/haskell/comments/t8rwe2/named_routes_in_servant/i0irjh6/,1647196446,1,False,True,False,haskell,t5_2qh36,r/haskell,public,,0,[],
4.0,[],False,,gdeest,,,[],,,,text,t2_f9a1w,False,False,"It actually seems to improve performance on non-nested APIs, which I find very surprising (but if confirmed, is absolutely excellent news.)",505d0f66cdf7057ab1d017062aed634de51cd844,True,False,,,,,0,1647196417,,0,{},i0irijr,False,t3_t8rwe2,False,True,t1_i0fwogr,/r/haskell/comments/t8rwe2/named_routes_in_servant/i0irijr/,1647196446,1,False,True,False,haskell,t5_2qh36,r/haskell,public,,0,[],
5.0,[],False,,davi_suga,,,[],,,,text,t2_79n3neq0,False,False,"In Brazil, Elixir, which is one of the top paying techs, has the average salary of around 2.2K USD a month (direct conversion). That's a HIGH salary here because the living cost is very low compared to other countries. 4K here is absolutely a top paying position.",e0fa0327776fbe689ca375811f9322dc2e6c896d,True,False,,,,,0,1647194918,,0,{},i0inwey,False,t3_td7txq,False,True,t1_i0i04sb,/r/haskell/comments/td7txq/4k_per_month_looking_for_someone_to_work_on_an/i0inwey/,1647194935,1,False,True,False,haskell,t5_2qh36,r/haskell,public,,0,[],
6.0,[],False,,doctahFoX,,,[],,,,text,t2_z6pv3,False,False,"This is perfect for my use case, thanks everyone! &lt;3",04062132ee143cf0722df5c089d2fb4d4573f12f,True,False,,,,,0,1647193902,,0,{},i0iley6,False,t3_t3zw0x,False,True,t1_i0ig10n,/r/haskell/comments/t3zw0x/monthly_hask_anything_march_2022/i0iley6/,1647193920,1,False,True,False,haskell,t5_2qh36,r/haskell,public,,0,[],
7.0,[],False,,SSchlesinger,,,[],,,,text,t2_jggeg,False,False,Link is broken for me,243e8ad1fc03f4a99196f140cd557f0801e97791,True,False,,,,,0,1647193806,,0,{},i0il6ew,False,t3_td4xbd,False,True,t3_td4xbd,/r/haskell/comments/td4xbd/property_testing_textbook/i0il6ew/,1647193820,1,False,True,False,haskell,t5_2qh36,r/haskell,public,,0,[],
8.0,[],False,,the-coot,,,[],,,,text,t2_1t3hztq2,False,False,It's back again.,740b34fce412939b7087aaa510e7a491fb75bd95,True,False,,,,,0,1647192711,,0,{},i0iih1l,True,t3_tcsnnz,False,True,t1_i0i32pw,/r/haskell/comments/tcsnnz/a_remark_on_lazy_st_monad_and_monadfix/i0iih1l/,1647192729,1,False,True,False,haskell,t5_2qh36,r/haskell,public,,0,[],
9.0,[],False,,tomejaguar,,,[],,,,text,t2_45sug,False,False,"On my Mac Book Pro M1 I was able to compile successfully and it used a few hundred MB of memory, so I haven't been able to reproduce the problem. I haven't heard any other reports of similar behaviour either.

If you're really interested in solving it then you could download [the git repo](https://github.com/tomjaguarpaw/product-profunctors/), run `cabal build`, see if you get the same error, and if so progressively remove parts of the package (by commenting them out in the source files) until you get something to compile. That way you may be able to pinpoint the exact problem.

I'm not sure what else to suggest at this point I'm afraid.",3d8ac0ffb1ff068737f61571a6e2af18e94d21e3,True,False,,,,,0,1647192150,,0,{},i0ih4gx,False,t3_tbn46e,False,True,t1_i0i07ze,/r/haskell/comments/tbn46e/out_of_memory_when_building_productprofunctors/i0ih4gx/,1647192163,1,False,True,False,haskell,t5_2qh36,r/haskell,public,,0,[],
10.0,[],False,,bss03,,,[],,,,text,t2_e3mbb,False,True,"You could also store `Maybe`s instead; gotta deal with the `Maybe` in the type of `lookup` anyway. :)

Using an IntSet as a free ""list"" could also work.  Then either `size map` or `minView freeSet` gives you a free (but potentially reused) index, and `size map + size freeSet` gives you an free (and ""new"") index.",05de26fb51137c05ad465ca0dfcba289b3da7591,True,False,,,,,0,1647192089,,0,{},i0igz8t,False,t3_t3zw0x,False,True,t1_i0ig10n,/r/haskell/comments/t3zw0x/monthly_hask_anything_march_2022/i0igz8t/,1647192102,1,False,True,False,haskell,t5_2qh36,r/haskell,public,,0,[],
11.0,[],False,,Noughtmare,,,[],,,,text,t2_shhn8,False,False,"The problem with using `size` as new key is that some entries in the map may be empty. Instead, you could track the empty cells in a [free list](https://en.wikipedia.org/wiki/Free_list) and use `size` only if the free list is empty.",424591d453eb13e65e82dcf4d98bef8cae810010,True,False,,,,,0,1647191692,,0,{},i0ig10n,False,t3_t3zw0x,False,True,t1_i0ieezu,/r/haskell/comments/t3zw0x/monthly_hask_anything_march_2022/i0ig10n/,1647191709,1,False,True,False,haskell,t5_2qh36,r/haskell,public,,0,[],
12.0,[],False,,bss03,,,[],,,,text,t2_e3mbb,False,True,"Yeah, for a job with that time split, any US based person will expect 150k, at least -- even if they are in ""fly over"" territory.  Technical managers make more than plain devs.

Maybe the position has perks that make up for the low pay -- a righteous cause or stake in future rewards, or maybe it's just targeted for a different job market.  Either way, there's value in being upfront about the base compensation.",5df14b2c8bc2c0559d198dc8e7bc4cce42344a0e,True,False,,,,,0,1647191514,,0,{},i0iflt3,False,t3_td7txq,False,True,t1_i0i04sb,/r/haskell/comments/td7txq/4k_per_month_looking_for_someone_to_work_on_an/i0iflt3/,1647191529,1,False,True,False,haskell,t5_2qh36,r/haskell,public,,0,[],
13.0,[],False,,bss03,,,[],,,,text,t2_e3mbb,False,True,"Use `IntMap` structure and `size` before the insert as the key.

Alternatively, I'm pretty sure there's a `Seq`uence type on hackage that has O(1) `length` (same as `IntMap.size`), O(lg n) `!` (same as `IntMap.lookup`), and O(1) `snoc` (`IntMap.insert` is O(lg n), so better).

I'd check the Edison library, searching for a fingertree implementation also works.",eb0bfe5c1b086bf6f3f1f68b89319c0d5fafc5d3,True,False,,,,,0,1647191016,,0,{},i0ieezu,False,t3_t3zw0x,False,True,t1_i0hxo5q,/r/haskell/comments/t3zw0x/monthly_hask_anything_march_2022/i0ieezu/,1647191029,1,False,True,False,haskell,t5_2qh36,r/haskell,public,,0,[],
14.0,[],False,,arkaros,,,[],,,,text,t2_8to21,False,False,I only work on uninteresting projects,cea50aa7a7958ca213bffe005f2f69e7db1bbfad,True,False,,,,,0,1647190745,,0,{},i0idr8p,False,t3_td7txq,False,False,t3_td7txq,/r/haskell/comments/td7txq/4k_per_month_looking_for_someone_to_work_on_an/i0idr8p/,1647190763,1,False,True,False,haskell,t5_2qh36,r/haskell,public,,0,[],
15.0,[],False,,bss03,,,[],,,,text,t2_e3mbb,False,True,"`Int#` is an unboxed type. `Int` is a boxed type.

At a high level, both has the semantics of a native-with signed integer.

`Int` has lazy semantics, so the runtime has to be able to hold not just a reified value, but also a closure/thunk.  It also wants to have all references to the same closure be updateable to the result (to avoid double-evaluation; be efficient). `Int` is in Haskell-by-the-report.

`Int#` has strict semantics, so it is fine for the runtime to just always a reified value, and pass it around by value/copy everywhere. `Int#` is GHC-specific.",2c09bcc780488086d8036f051a4d903d4385ec56,True,False,,,,,0,1647190540,,0,{},i0id9n9,False,t3_tcmtk2,False,True,t1_i0h2493,/r/haskell/comments/tcmtk2/what_is_the_point_of_solo_beginner_question/i0id9n9/,1647190552,1,False,True,False,haskell,t5_2qh36,r/haskell,public,,0,[],
16.0,[],False,,bss03,,,[],,,,text,t2_e3mbb,False,True,"Instead of `do { liftIO x }` you can do `liftIO do { x }` and instead of `\x -&gt; liftIO y` you can do `liftIO &lt;$&gt; (\x -&gt; y)`.

Pulling `liftX` in/out of lambdas and `do`s might let you combine them with others.",fd7135a4ad6e0b6777f757042cc38792a93a88b4,True,False,,,,,0,1647189980,,0,{},i0ibxbc,False,t3_td22b3,False,True,t1_i0h2zug,/r/haskell/comments/td22b3/question_from_a_beginner_is_liftio_a_code_smell/i0ibxbc/,1647189995,1,False,True,False,haskell,t5_2qh36,r/haskell,public,,0,[],
17.0,[],False,,BlancII,,,[],,,,text,t2_jl7q6x5x,False,False,4k for a part time job (30-40%)?,da8373aa0db91d63133f8cbac5dddbf31d1a1484,True,False,,,,,0,1647189773,,0,{},i0ibfdz,False,t3_td7txq,False,True,t3_td7txq,/r/haskell/comments/td7txq/4k_per_month_looking_for_someone_to_work_on_an/i0ibfdz/,1647189790,1,False,True,False,haskell,t5_2qh36,r/haskell,public,,0,[],
18.0,[],False,,bss03,,,[],,,,text,t2_e3mbb,False,True,"Aw, nuts. :(

I was guessing.",dab5e9b967ba31a1fe992db0e4bf0bfb3d500dd2,True,False,,,,,0,1647189719,,0,{},i0ibalu,False,t3_tcmtk2,False,True,t1_i0hv8vi,/r/haskell/comments/tcmtk2/what_is_the_point_of_solo_beginner_question/i0ibalu/,1647189734,1,False,True,False,haskell,t5_2qh36,r/haskell,public,,0,[],
19.0,[],False,,ocramz_,,,[],,,,text,t2_jaolcjrr,False,False,Site is unreachable,63053022edb0ea0bfefaa8926a73ea562a1034e7,True,False,,,,,0,1647186210,,0,{},i0i32pw,False,t3_tcsnnz,False,True,t3_tcsnnz,/r/haskell/comments/tcsnnz/a_remark_on_lazy_st_monad_and_monadfix/i0i32pw/,1647186227,1,False,True,False,haskell,t5_2qh36,r/haskell,public,,0,[],
20.0,[],False,,CultsCultsCults,,,[],,,,text,t2_688e3,False,False,I would like his nuts in Haskell script for 4K per month,3daf37ee70bf9100f4dd1836e45b672a1cad922f,True,False,,,,,0,1647185656,,0,{},i0i1tip,False,t3_td7txq,False,True,t1_i0i04sb,/r/haskell/comments/td7txq/4k_per_month_looking_for_someone_to_work_on_an/i0i1tip/,1647185669,1,False,True,False,haskell,t5_2qh36,r/haskell,public,,0,[],
21.0,[],False,,pituitarianices,,,[],,,,text,t2_druf6com,False,False,Its an excellent rate in Portugal at least.,f3c3c96fa4e248cc2c0d0ce009ee5b03940b880d,True,False,,,,,0,1647185508,,0,{},i0i1hje,False,t3_td7txq,False,True,t1_i0i04sb,/r/haskell/comments/td7txq/4k_per_month_looking_for_someone_to_work_on_an/i0i1hje/,1647185526,1,False,True,False,haskell,t5_2qh36,r/haskell,public,,0,[],
22.0,[],False,,Swordlash,,,[],,,,text,t2_2fpxe4mw,False,False,"I am unable to spot the ghc process in the activity monitor, it takes about 3 secs between I enter the command and it fails, as if it were suddenly trying to allocate a huge amount of memory. I'm unable to test any version below [10.0.0.1](https://10.0.0.1), as it requires older ghc and 8.10.7 is the oldest one (in terms of versioning) that is supported on aarch64.",714d9bb4145bdb45fc573c5530398b9e293f37f7,True,False,,,,,0,1647185290,,0,{},i0i1083,True,t3_tbn46e,False,True,t1_i0a924o,/r/haskell/comments/tbn46e/out_of_memory_when_building_productprofunctors/i0i1083/,1647185303,1,False,True,False,haskell,t5_2qh36,r/haskell,public,,0,[],
23.0,[],False,,Swordlash,,,[],,,,text,t2_2fpxe4mw,False,False,"So have you reproduced the issue, or is it just failing for me?",a604c503dafe7f363c83d38f8612f221938aa691,True,False,,,,,0,1647184930,,0,{},i0i07ze,True,t3_tbn46e,False,True,t1_i0a924o,/r/haskell/comments/tbn46e/out_of_memory_when_building_productprofunctors/i0i07ze/,1647184948,1,False,True,False,haskell,t5_2qh36,r/haskell,public,,0,[],
24.0,[],False,,dun-ado,,,[],,,,text,t2_ihltqlra,False,False,"Let’s assume US dollars. $4k a month is $48k a year. Either the poster of this job is completely ignorant of market rates or is trying to find a sucker to work way below market rates. 

Regardless, you definitely don’t want to work for someone who could possibly post a job like that.",da72ff9e072031b842405fe61971f369345c42a3,True,False,,,,,0,1647184890,,0,{},i0i04sb,False,t3_td7txq,False,True,t3_td7txq,/r/haskell/comments/td7txq/4k_per_month_looking_for_someone_to_work_on_an/i0i04sb/,1647184902,1,False,True,False,haskell,t5_2qh36,r/haskell,public,,0,[],
25.0,[],False,,doctahFoX,,,[],,,,text,t2_z6pv3,False,False,"Yeah I think so too, but I have to come up with a not-extremely-inefficient way of getting a free index at every insertion. Maybe I'll just save the greatest taken index and call it a day :D",87b555b5935e67fc6740d0b3b195325b1ca79f33,True,False,,,,,0,1647183761,,0,{},i0hxo5q,False,t3_t3zw0x,False,True,t1_i0htfzq,/r/haskell/comments/t3zw0x/monthly_hask_anything_march_2022/i0hxo5q/,1647183776,1,False,True,False,haskell,t5_2qh36,r/haskell,public,,0,[],
26.0,[],False,,phadej,,,[],,,,text,t2_4qmwn,False,False,"Checking existential properties (i.e. ""there is x such that x = f x"" or ""there is x such that x &lt; f x"") with `QuickCheck` is generally not recommended. There's always a chance that `QuickCheck` won't find an example value.

I'll assume that `f = g y`, i.e. it is a function family, otherwise you could just find parameters for which `f x = x` or `f x &lt; x` and write two ordinary assertion tests.

Better approach is to provide an explicit witness. Instead of ""classical"" 

    forall y. exists x. g y x = x 

make it constructive

    forall y. g y (h y) = h y

where `h` is a function constructing a value `x` at which `g y x = x`.",2304786f5e028aec1c7616fe6b438d63e68ec3c5,True,False,,,,,0,1647183387,,0,{},i0hwvw9,False,t3_tcwird,False,True,t3_tcwird,/r/haskell/comments/tcwird/sometimes_for_quickcheck_verify_that_an/i0hwvw9/,1647183399,1,False,True,False,haskell,t5_2qh36,r/haskell,public,,0,[],
27.0,[],False,,integrate_2xdx_10_13,,,[],,,,text,t2_h94wf5c8,False,False,"Box = on the heap, Unboxed = on the stack.",23c050bff0c22c2b73f84d737a3012d84d41953b,True,False,,,,,0,1647183325,,0,{},i0hwr8m,False,t3_tcmtk2,False,True,t1_i0h2493,/r/haskell/comments/tcmtk2/what_is_the_point_of_solo_beginner_question/i0hwr8m/,1647183342,1,False,True,False,haskell,t5_2qh36,r/haskell,public,,0,[],
28.0,[],False,,JohnnyBenis,,,[],,,,text,t2_5n43eni4,False,False,4k of what? Dollars? Gold bars? Punches to the face in case you fail to do your job?,89cafecbcdeeaac83a5a9c20c370960c2cee157a,True,False,,,,,0,1647183237,,0,{},i0hwksl,False,t3_td7txq,False,False,t3_td7txq,/r/haskell/comments/td7txq/4k_per_month_looking_for_someone_to_work_on_an/i0hwksl/,1647183253,1,False,True,False,haskell,t5_2qh36,r/haskell,public,,0,[],
29.0,[],False,,maerwald,,,[],,,,text,t2_t8qgl,False,False,No. It's fine. Carry on.,318445babfaf37370fac06d456d6022eaf6944ec,True,False,,,,,0,1647182918,,0,{},i0hvwca,False,t3_td22b3,False,True,t3_td22b3,/r/haskell/comments/td22b3/question_from_a_beginner_is_liftio_a_code_smell/i0hvwca/,1647182949,1,False,True,False,haskell,t5_2qh36,r/haskell,public,,0,[],
30.0,[],False,,phadej,,,[],,,,text,t2_4qmwn,False,False,"Solo's documentation says

&gt; The most important feature of Solo is that it is possible to force its ""outside"" (usually by pattern matching) without forcing its ""inside"", because it is defined as a datatype rather than a newtype. One situation where this can be useful is when writing a function to extract a value from a data structure. Suppose you write an implementation of arrays and offer only this function to index into them:

... https://hackage.haskell.org/package/base-4.16.0.0/docs/Data-Tuple.html#t:Solo",9ba49ed4b535c8cc8042c2e19fc38bea9ec21c0c,True,False,,,,,0,1647182679,,0,{},i0hven3,False,t3_tcmtk2,False,True,t3_tcmtk2,/r/haskell/comments/tcmtk2/what_is_the_point_of_solo_beginner_question/i0hven3/,1647182689,1,False,True,False,haskell,t5_2qh36,r/haskell,public,,0,[],
31.0,[],False,,phadej,,,[],,,,text,t2_4qmwn,False,False,"&gt; Also, in GHC there's different treatment of boxed and unboxed types. I think maybe Identity can only be applied to boxed types, were Solo can be applied to any type. 

If you meant to say that `Solo` is levity-polymorphic, i.e. we could write `Solo Int#`, than that' iss wrong: `Solo` is not levity-polymorphic.",4752cdc2bcc3c6d752c5fbe7909554ca4484d28c,True,False,,,,,0,1647182601,,0,{},i0hv8vi,False,t3_tcmtk2,False,True,t1_i0edaxj,/r/haskell/comments/tcmtk2/what_is_the_point_of_solo_beginner_question/i0hv8vi/,1647182615,1,False,True,False,haskell,t5_2qh36,r/haskell,public,,0,[],
32.0,[],False,,phadej,,,[],,,,text,t2_4qmwn,False,False,"`Only` is a `newtype`, not `data`. (I.e. `Identity` vs `Solo`).",4f9e40511250ffd15b181222f552754afeb5c190,True,False,,,,,0,1647182410,,0,{},i0huumr,False,t3_tcmtk2,False,True,t1_i0h3kpk,/r/haskell/comments/tcmtk2/what_is_the_point_of_solo_beginner_question/i0huumr/,1647182425,1,False,True,False,haskell,t5_2qh36,r/haskell,public,,0,[],
33.0,[],False,,tom-md,,,[],,,,text,t2_7b2si,False,False,A Map works be easiest. I'd start there and only change based on actual needs (vs expectations or guesses).,f7916af54aa76e86a56f22a135073e25d7eba01b,True,False,,,,,0,1647181708,,0,{},i0htfzq,False,t3_t3zw0x,False,True,t1_i0h9mdm,/r/haskell/comments/t3zw0x/monthly_hask_anything_march_2022/i0htfzq/,1647181721,1,False,True,False,haskell,t5_2qh36,r/haskell,public,,0,[],
34.0,[],False,,maerten,,,[],,,,text,t2_4fee6,False,False,"Just fyi, there’s a new release of cryptonite that works with ghc9.2",3573130b545f48a2f2d5a950df0002054c2e3012,True,False,,,,,0,1647180913,,0,{},i0hrwq6,False,t3_t8a53f,False,True,t1_hzw3kka,/r/haskell/comments/t8a53f/announce_ghc_922_is_now_available/i0hrwq6/,1647180931,1,False,True,False,haskell,t5_2qh36,r/haskell,public,,0,[],
35.0,[],False,,AdhesivenessTrue9696,,,[],,,,text,t2_5jzjx1br,False,False,Looks great,6e3e37482d605264790cb75c5985adb3eb04c2c6,True,False,,,,,0,1647174250,,0,{},i0hgtz4,False,t3_tcjwvv,False,True,t3_tcjwvv,/r/haskell/comments/tcjwvv/haskell_almost_standard_libraries_is_now_complete/i0hgtz4/,1647174266,1,False,True,False,haskell,t5_2qh36,r/haskell,public,,0,[],
36.0,[],False,,SleezyROM,,,[],,,,text,t2_7meizuh9,False,False,"The consumer is actually spawned off with Pipes.Concurrent, and exists solely to listening for broadcast messages. Maybe forever is over kill but for my simple proof of concept it's fine.",ff310ad0c6ba59f253f75c00fff82e359aed586d,True,False,,,,,0,1647172962,,0,{},i0hf1xe,True,t3_td22b3,False,True,t1_i0hbjdf,/r/haskell/comments/td22b3/question_from_a_beginner_is_liftio_a_code_smell/i0hf1xe/,1647172974,1,False,True,False,haskell,t5_2qh36,r/haskell,public,,0,[],
37.0,[],False,,affinehyperplane,,,[],,,,text,t2_12xogr,False,False,"Cool book, but I think it is mostly unrelated to property-based testing (which was my first thought when reading the title). Rather,

&gt; the goal is to design algorithms that decide whether their input satisfies a predetermined property in sublinear time, or even in constant time.

which is interesting, but for property-based testing, the part which is usually more challenging is coming up with good generators for your test data, and not how to design faster ways of testing the desired (generally rather simple) properties of the generated test data.",24695b4f997d45ef158edacdc14369ff3182de07,True,False,,,,,0,1647172683,,0,{},i0heos5,False,t3_td4xbd,False,True,t3_td4xbd,/r/haskell/comments/td4xbd/property_testing_textbook/i0heos5/,1647172695,1,False,True,False,haskell,t5_2qh36,r/haskell,public,,0,[],
38.0,[],False,,r3dnaz,,,[],,,,text,t2_2ornf0zo,False,False,"\&gt; Googling

i think you misspelled ""hoogling"" there. https://hoogle.haskell.org/?hoogle=Solo",22ee3f3e7675ed9fb79a254f997ee42c0327d5c3,True,False,,,,,0,1647172346,,0,{},i0he8yu,False,t3_tcmtk2,False,True,t3_tcmtk2,/r/haskell/comments/tcmtk2/what_is_the_point_of_solo_beginner_question/i0he8yu/,1647172362,1,False,True,False,haskell,t5_2qh36,r/haskell,public,,0,[],
39.0,[],False,,ocramz_,,,[],,,,text,t2_jaolcjrr,False,False,"Also worth noting that this will block your thread forever. You want the monad to be something that can fork threads, like IO or MonadUnliftIO m =&gt; m ( ... )",10796005f5e25f6f8610220f1365f514d27c9d01,True,False,,,,,0,1647170196,,0,{},i0hbjdf,False,t3_td22b3,False,True,t1_i0h3297,/r/haskell/comments/td22b3/question_from_a_beginner_is_liftio_a_code_smell/i0hbjdf/,1647170211,1,False,True,False,haskell,t5_2qh36,r/haskell,public,,0,[],
40.0,[],False,,doctahFoX,,,[],,,,text,t2_z6pv3,False,False,"Hello everyone! I have a ""what data structure should I use"" question: I need a structure representing a very simplified version of a heap memory, namely I want the following operations:

1.  insertion at un unspecified point, but the insert operation should return a pointer/index to the position of the inserted value

1. retrieval of a value, using the pointer/index obtained after the insertion

1. removal of a value, using the same pointer/index

I don't want to actually model how memory works, so all values will have the same type and they will occupy a single space in this data structure. (Hence there should always be space to insert a new element)

The two options that came to my mind are `Map`s and `MVector`s (of `Maybe`s, so that removal is efficient), but I don't know if there is some data structure more suited to my request. Also, I have never used `Vector` in Haskell, so I don't really know if it would work lol",9f1d08c0a147d2380b24ad1a027116a8ae5c4a5a,True,False,,,,,0,1647168606,,0,{},i0h9mdm,False,t3_t3zw0x,False,True,t3_t3zw0x,/r/haskell/comments/t3zw0x/monthly_hask_anything_march_2022/i0h9mdm/,1647168620,1,False,True,False,haskell,t5_2qh36,r/haskell,public,,0,[],
41.0,[],False,,Goheeca,,,[],,,,text,t2_97s0g,False,False,[`Int#`](https://downloads.haskell.org/~ghc/9.2.2/docs/html/users_guide/exts/primitives.html#unboxed-types) hash sign at the end typically indicates that.,5dc0de8bccc5b16e7422f15f70689a60cf621c23,True,False,,,,,0,1647164868,,0,{},i0h53q7,False,t3_tcmtk2,False,True,t1_i0h2493,/r/haskell/comments/tcmtk2/what_is_the_point_of_solo_beginner_question/i0h53q7/,1647164883,1,False,True,False,haskell,t5_2qh36,r/haskell,public,,0,[],
42.0,[],False,,on_hither_shores,,,[],,,,text,t2_jnsj1me6,False,False,float `a` out = move the binding `a = some stuff` to an enclosing scope,4eddb15afd92cfb9a5850034dd907f5e390d5217,True,False,,,,,0,1647163752,,0,{},i0h3rkg,False,t3_td22b3,False,True,t1_i0h2zug,/r/haskell/comments/td22b3/question_from_a_beginner_is_liftio_a_code_smell/i0h3rkg/,1647163768,1,False,True,False,haskell,t5_2qh36,r/haskell,public,,0,[],
43.0,[],False,,TechnoEmpress,,,[],,,,text,t2_8nmmm9k7,False,False,"Before `Solo` existed, we had a multitude of similarly-named 1-tuples like https://hackage.haskell.org/package/postgresql-simple-0.6.4/docs/Database-PostgreSQL-Simple.html#t:Only for a variety of purposes. 
The documentation of `Only` is actually quite clear on its purpose.",a4d61c5dfe6b9aa0d52ee69ff9608f331e909328,True,False,,,,,0,1647163589,,0,{},i0h3kpk,False,t3_tcmtk2,False,True,t3_tcmtk2,/r/haskell/comments/tcmtk2/what_is_the_point_of_solo_beginner_question/i0h3kpk/,1647163602,1,False,True,False,haskell,t5_2qh36,r/haskell,public,,0,[],
44.0,[],False,,CoBuddha,,,[],,,,text,t2_12byxs,False,False,what do you mean by that?,01d87fbfd96ba1cee9eb50cb208366ad5de88eec,True,False,,,,,0,1647163356,,0,{},i0h3b0a,True,t3_tc7g4q,False,True,t1_i0h22hj,/r/haskell/comments/tc7g4q/any_haskelllike_languages_with_native_frp/i0h3b0a/,1647163369,1,False,True,False,haskell,t5_2qh36,r/haskell,public,,0,[],
45.0,[],False,,SleezyROM,,,[],,,,text,t2_7meizuh9,False,False,"That makes sense, my imperative programming brain kicks in sometimes and I simply blank on when I can create another monad.",5e5bd34e531d9c08b5a12015bfff790a908c9fb5,True,False,,,,,0,1647163150,,0,{},i0h3297,True,t3_td22b3,False,True,t1_i0h2ggw,/r/haskell/comments/td22b3/question_from_a_beginner_is_liftio_a_code_smell/i0h3297/,1647163163,1,False,True,False,haskell,t5_2qh36,r/haskell,public,,0,[],
